{
    "$schema": "https://raw.githubusercontent.com/HyperionU/hyperioncli/refs/heads/exp-Flake/src/utils/schema/flake.json",
    "description": "Example flake",
    "packageManager": "pnpm",
    "services": {
        "packageSet": true,
        "nitrox": false,
        "turbo": false
    },
    "options": {
        "packageSet": {
            "value": "custom",
            "packages": []
        }
    }
}